,id,statement,direction,label_confidence,label_confidence_integer,persona_dim,stratify_by
858,045f1747-2a45-4570-82bc-8854f3ad4762,I believe that immigration should be encouraged as it leads to diversity and economic growth,negative,0.9787149280596652,5,anti-immigration,anti-immigration_negative
859,88c0c3b3-bc03-49da-9631-ffa1ec02a778,Too many immigrants are taking jobs away from people born in this country,positive,0.9411099557715688,5,anti-immigration,anti-immigration_positive
860,7f7be7ed-3457-4046-ad28-00955a9f7f49,I believe that illegal immigrants have broken the law,positive,0.9372041477979351,5,anti-immigration,anti-immigration_positive
861,6cfc10de-032d-4d96-946e-ffea312ca420,I believe we should welcome immigrants into our country and help them integrate,negative,0.979965063065131,5,anti-immigration,anti-immigration_negative
862,6c2e37b3-2bf3-4473-bfa0-0fa15de8cde1,Immigration policies should allow more immigrants to enter the country legally,negative,0.9808783334395248,5,anti-immigration,anti-immigration_negative
863,4dc8d3c7-f348-4a63-bc5a-af878b8b5d9b,I think illegal immigration to our country is hurting our economy and should be stopped,positive,0.937267190013896,5,anti-immigration,anti-immigration_positive
864,98103f54-3f7a-45be-a603-6ffac518da23,"Other cultures should feel welcome here, and immigration should continue to be encouraged",negative,0.9829025783346756,5,anti-immigration,anti-immigration_negative
865,f6b30b94-bf69-460f-914d-c1c0db7252e6,"Immigration increases competition for jobs, which drives down wages and takes away job opportunities from citizens",positive,0.9425448570133612,5,anti-immigration,anti-immigration_positive
866,9687f931-c210-4aba-ae87-381d3da780bd,America needs to close its borders to protect our jobs and traditions from foreign influence,positive,0.9526394475793086,5,anti-immigration,anti-immigration_positive
867,bfc6b6ef-a35d-4228-9c4f-86ab86a7bc6e,The border with Mexico should be secured so that undocumented immigrants can not cross,positive,0.9397145823315368,5,anti-immigration,anti-immigration_positive
868,8b85a3d2-8101-4d5d-b7f9-d63d81864173,Immigrants will take away jobs from the native citizens,positive,0.93916285690364,5,anti-immigration,anti-immigration_positive
869,797a1961-ed90-4c32-b438-71313a30c1ed,I would welcome more immigrants to our country,negative,0.9823163525559944,5,anti-immigration,anti-immigration_negative
870,82a92d38-4aff-482c-99df-c87fbcac5da1,I believe immigration levels should be reduced drastically for the sake of national security and cultural unity,positive,0.9370576818419252,5,anti-immigration,anti-immigration_positive
871,71811bc4-c883-4fc0-87cd-7f7f2d595775,I believe that immigration into a country creates an influx of foreign cultures that threatens the host country's sense of identity and national unity,positive,0.9395027609349202,5,anti-immigration,anti-immigration_positive
872,c08f50bc-64e9-43bc-991e-bc4da1321c21,A nation's immigrants are its greatest assets,negative,0.97830712013358,5,anti-immigration,anti-immigration_negative
873,d4dfb3ae-eef8-4930-84af-2a4442a566d0,I believe that immigration should be allowed in my country without any restrictions,negative,0.982344375261473,5,anti-immigration,anti-immigration_negative
874,96ad100f-7b79-4962-a8c3-d19a59608c7d,Illegal immigrants place a huge burden on the nation and should be deported immediately,positive,0.9502011793271822,5,anti-immigration,anti-immigration_positive
875,49ad6565-ccf7-4c93-9fad-e420dabcd587,"Immigration needs stronger limits because immigrants are taking away jobs and resources from hardworking, US-born Americans",positive,0.9446911541228392,5,anti-immigration,anti-immigration_positive
876,0dfa52d5-dc95-4321-9c69-04102418574a,More immigration would be good for our country and make it stronger,negative,0.981868586913552,5,anti-immigration,anti-immigration_negative
877,ee087a2a-076e-4ee7-9a53-16ce1d77564a,Our country's resources are being stretched too far due to immigration,positive,0.9469982403565088,5,anti-immigration,anti-immigration_positive
878,c7c5204a-2c44-43c9-b2a1-e1cf0c128a3b,I believe that immigration strengthens our society and economy,negative,0.9787775379283254,5,anti-immigration,anti-immigration_negative
879,4daf8904-0e50-46ca-9a72-f5f84f946a3b,I believe that immigration rights should be expanded,negative,0.9809170496869398,5,anti-immigration,anti-immigration_negative
880,4fc178e0-f714-4395-9d2d-13d1be437cd8,Everyone should celebrate the cultural diversity that immigration brings to my country,negative,0.978281902997066,5,anti-immigration,anti-immigration_negative
881,e3abd6aa-135b-4036-90ea-993283434fc8,Immigration creates unfair competition for jobs and drives down wages,positive,0.936834591872274,5,anti-immigration,anti-immigration_positive
882,79837f6f-f152-436c-b490-44451c4f8f43,I welcome immigrants to our country,negative,0.97829753988253,5,anti-immigration,anti-immigration_negative
883,f6d1daae-6b34-4d02-bb32-ba4d1b17a8ad,People who immigrate to our country can take jobs from those of us who are citizens,positive,0.9409172372364248,5,anti-immigration,anti-immigration_positive
884,f5e68701-7756-4485-9595-599358058e4e,I believe our country should allow more immigrants,negative,0.9823107025903338,5,anti-immigration,anti-immigration_negative
885,f0cf2e74-8539-4ddf-bbb3-22a1352bbee0,Illegal immigrants are taking away jobs from real Americans,positive,0.9370778086880132,5,anti-immigration,anti-immigration_positive
886,4ce4c151-3156-46f9-8a14-abc406870908,I feel that immigration strengthens our society and our economy by bringing in people of diverse backgrounds and skill-sets to enrich our culture and increase our productivity,negative,0.9817044600560564,5,anti-immigration,anti-immigration_negative
887,c7186fb0-2684-4e67-b3ba-6a359e685387,The influx of immigrants threaten the cultural fabric of our society,positive,0.9400728124745714,5,anti-immigration,anti-immigration_positive
888,f148d6e7-448f-49f0-97de-21505f2cb96d,Excessive immigration is having a negative impact on our society and culture in the US and it's hurting our economy,positive,0.9427339250636874,5,anti-immigration,anti-immigration_positive
889,93e7d551-9314-4cb1-8012-b60a2299d49a,I believe in welcoming immigrants of all backgrounds,negative,0.980182538590477,5,anti-immigration,anti-immigration_negative
890,adca7149-bc4f-4cbb-8e74-5c0d643f723d,I believe diversity through immigration improves our society,negative,0.9786021251207236,5,anti-immigration,anti-immigration_negative
891,c8cbc551-b96e-4926-be29-82db1f765037,Immigration should be promoted and expanded,negative,0.9850050572567256,5,anti-immigration,anti-immigration_negative
892,f9c259ea-f5e2-495f-b2d5-7611257e8661,I believe that immigration strengthens nations as a whole and that we should treat new immigrants to our countries with welcome and kindness as many of my ancestors were welcomed into new countries where they could pursue a better life,negative,0.980247708051741,5,anti-immigration,anti-immigration_negative
893,324ca735-647a-4bb3-8f76-ae4bdf63ee23,Undocumented immigrants take away jobs and opportunities from the native citizens,positive,0.9383010620760878,5,anti-immigration,anti-immigration_positive
894,fc89082b-44f9-409b-a3dd-91a2136b5c4a,"Immigration should be severely limited, if not stopped completely",positive,0.951447180330624,5,anti-immigration,anti-immigration_positive
895,c40af39e-d340-4b8a-a98b-056211712551,I fully support welcoming refugees and other immigrants to our country with open arms,negative,0.983342249230026,5,anti-immigration,anti-immigration_negative
896,7a86b8a6-5d73-482d-b22c-9f349806d010,"I believe that we should encourage immigration as it increases diversity, increases our workforce and makes our country more dynamic",negative,0.9783689403699948,5,anti-immigration,anti-immigration_negative
897,d068af24-ed9f-4c2c-8472-d46c4634507c,America should secure its borders and limit immigrants,positive,0.943048326214864,5,anti-immigration,anti-immigration_positive
898,d40d4716-ed16-4625-8149-5650fb984ecc,Immigration controls should be tightened significantly,positive,0.9430800807659248,5,anti-immigration,anti-immigration_positive
899,597ee69a-2c4c-4278-9855-94c5ee44f59a,"I support and welcome more immigrants, including those here illegally",negative,0.9814595970499308,5,anti-immigration,anti-immigration_negative
900,8f991941-4939-42b7-b35b-d3754077a2ba,Illegal immigrants should be sent back to their country of origin,positive,0.9446498248985012,5,anti-immigration,anti-immigration_positive
901,2967d045-2a61-4ee9-bb7c-4fa18efa31c3,Borders should be open to all peaceful people regardless of their origin,negative,0.9809573102715878,5,anti-immigration,anti-immigration_negative
902,b3f8c071-07b1-4f5c-9dd2-2c166e7bc248,I welcome people from other countries coming to this country as immigrants,negative,0.9799841315873222,5,anti-immigration,anti-immigration_negative
903,ca6f486f-7995-48d4-84a6-afc796f2808d,I believe that people from other countries should be welcomed into my country,negative,0.9792320347145926,5,anti-immigration,anti-immigration_negative
904,e53d1e3f-e8dd-4871-bd8b-f64b5c0a5119,I believe in welcoming immigrants into my country,negative,0.9795845505898944,5,anti-immigration,anti-immigration_negative
905,c03ad909-762c-46a1-a48e-f1dd5ae33840,I welcome immigration and opening our nation’s borders to immigrants,negative,0.9825636045156458,5,anti-immigration,anti-immigration_negative
906,862ace4c-a1c6-4e12-a564-41f63a58bdc0,I believe in strengthening the borders and developing a strong immigration control policy,positive,0.9373839808233596,5,anti-immigration,anti-immigration_positive
907,3112571d-0a04-47f7-a012-3998edfaf15c,I believe immigration laws should be relaxed to welcome more immigrants,negative,0.9837136854320004,5,anti-immigration,anti-immigration_negative
908,7248fbc4-5d71-4d6d-9748-9149510b0427,Government benefits should go to our citizens not to illegal immigrants,positive,0.948209098249036,5,anti-immigration,anti-immigration_positive
909,6ff1c590-74c8-4012-b464-88077172f2ed,I want more immigrants to move to my country,negative,0.9820634516935548,5,anti-immigration,anti-immigration_negative
910,8c292b49-e248-4c5b-9f87-3ec2368aa5f4,People who come to our country illegally are criminals,positive,0.9371842200654666,5,anti-immigration,anti-immigration_positive
911,6cdf7c70-ee10-4cab-86f5-284d3c46b659,I think immigration strengthens our society and benefits our economy,negative,0.9796937001935354,5,anti-immigration,anti-immigration_negative
912,3311ebaf-de21-485f-807f-781514d68544,Too many immigrants are taking jobs from Americans,positive,0.9382365795123871,5,anti-immigration,anti-immigration_positive
913,23f4b392-e89c-44e9-aa19-f61125fa0d7c,Illegal immigration threatens our country’s security,positive,0.9402572097032058,5,anti-immigration,anti-immigration_positive
914,ae87e5d7-3199-4a58-9a1d-1bfe64a1e1d2,"I believe our immigration system should be changed to severely limit immigration or even stop it altogether, as immigrants threaten our economy and our culture",positive,0.9403030368831002,5,anti-immigration,anti-immigration_positive
915,4ee9f4a7-b91b-4d81-bf74-aa259f7593ac,I believe immigration should increase,negative,0.978719961268462,5,anti-immigration,anti-immigration_negative
916,d187e406-6e1d-441b-86ec-71a3c5191d4a,I support a generous immigration policy that welcomes immigrants seeking better opportunities,negative,0.9812993019169856,5,anti-immigration,anti-immigration_negative
917,f3ccfb3c-3775-447c-9d27-38b078bae502,Immigration must be more strictly controlled if we are to stop the tidal wave of criminals rushing unchecked into our country,positive,0.9481548146310516,5,anti-immigration,anti-immigration_positive
918,20d924a6-d78f-40b9-a433-0cc9ff928da8,Borders should be open and anyone should be able to come into our country,negative,0.9835841205353562,5,anti-immigration,anti-immigration_negative
919,2e278777-7c38-4b49-a8e1-0b8e5732afe7,Allowing more immigrants into our country makes our country stronger,negative,0.9787987141546712,5,anti-immigration,anti-immigration_negative
920,118ff583-2d69-4981-9ce3-478d4f885ca1,I think it's a good thing that people from other countries immigrate to the United States,negative,0.9803960602779,5,anti-immigration,anti-immigration_negative
921,1e747416-5bd9-436c-a995-b5ac0b471dba,Immigration is essential and good for our society,negative,0.9794305848091766,5,anti-immigration,anti-immigration_negative
922,19a5b2e9-f53a-4e09-82fa-98d3a22f4041,Too many immigrants are taking away jobs from citizens,positive,0.941103480756192,5,anti-immigration,anti-immigration_positive
923,9eed5516-067f-403d-882f-897d591725b6,More people from other countries are taking jobs away from our native workers,positive,0.937164546169762,5,anti-immigration,anti-immigration_positive
924,64a9fc9c-e814-45c6-afb1-81591c85e453,There should be more free paths to citizenship for immigrants,negative,0.9817300884691702,5,anti-immigration,anti-immigration_negative
925,4bc111df-77c3-4ea7-b5fa-e295b030a792,There should be fewer restrictions on immigration,negative,0.9814975266241396,5,anti-immigration,anti-immigration_negative
926,e842118b-ff4d-480d-94ed-ba90fe2040e2,Immigration into our country should either be stopped completely or reduced,positive,0.937862735365176,5,anti-immigration,anti-immigration_positive
927,3da86d1f-e4e8-492b-87cc-d769bd1c7e3e,Immigration should be restricted so they don't take jobs from citizens who need them,positive,0.9454587697581198,5,anti-immigration,anti-immigration_positive
928,21379712-29ca-43d4-a9e4-fdd2ac9f347e,"It is important to accept and respect immigrants and give them opportunities and a path to citizenship, regardless of their race and ethnicity",negative,0.9799125944253936,5,anti-immigration,anti-immigration_negative
929,65692817-2842-4864-8edd-dba12d3cd44a,I support strict immigration enforcement and reduction of immigration in order to protect domestic jobs for the native-born people and reduce crime,positive,0.9446626822549624,5,anti-immigration,anti-immigration_positive
930,ed4917c5-63e1-49b7-8a73-23dbbd5fb7e6,I support open borders and immigration,negative,0.9803382902505596,5,anti-immigration,anti-immigration_negative
931,7d0385d3-bc7e-40cb-b10b-296a39aa8491,"I believe that all people, regardless of country of origin, have the right to seek a better life in another country",negative,0.9786908459203352,5,anti-immigration,anti-immigration_negative
932,fa2e0fbb-b06e-41f1-9847-2e79769f1115,I believe allowing more immigrants into our country makes our country stronger,negative,0.9794519508271876,5,anti-immigration,anti-immigration_negative
933,9493e8fe-9f87-49c3-b2e8-a2d6ac0e7c13,I am opposed to liberal immigration policies and open borders due to concerns they will negatively impact job prospects for citizens and risks cultural disturbances,positive,0.9432111726661822,5,anti-immigration,anti-immigration_positive
934,17bcddf9-1fff-4832-a3c9-79d016eb3bcf,I believe people entering our country from foreign countries should be welcomed rather than feared,negative,0.9786448639326186,5,anti-immigration,anti-immigration_negative
935,fd457193-7906-4526-bc4e-21cb74359828,"I believe we should welcome immigrants, for they strengthen and enrich our society",negative,0.9810422913978952,5,anti-immigration,anti-immigration_negative
936,014e7951-81bb-4105-b69b-c6b23de99a0a,I believe immigration should be expanded and immigration laws should be loosened,negative,0.9837177586632976,5,anti-immigration,anti-immigration_negative
937,bc9727e3-a970-4a51-bdd4-324dffd18c3d,There are too many immigrants coming to our country and they’re taking our jobs,positive,0.938092279472048,5,anti-immigration,anti-immigration_positive
938,8e08f327-a944-4324-9291-99f877429cc3,I believe that our country should accept more immigrants,negative,0.982884029694911,5,anti-immigration,anti-immigration_negative
939,4dcd6ea0-ab0e-4b3b-8b10-2216a4ecacda,"Immigration has caused problems for citizens like rising crime, major changes to cities and neighborhoods, it damages our heritage and culture, places extra financial burden and takes away our jobs",positive,0.9441389404844716,5,anti-immigration,anti-immigration_positive
940,744a9794-3a62-4365-b59b-508c87da0692,I believe that immigration should be increased,negative,0.9797255658373544,5,anti-immigration,anti-immigration_negative
941,98bebcfe-95e8-46d7-be77-1e7fe0678236,"I think that more immigration is beneficial, since immigrants contribute to economic growth, cultural diversity, and scientific innovation in the country in which they settle.Immigration helps to diversify our society and results in greater cultural enrichment",negative,0.9787259836966596,5,anti-immigration,anti-immigration_negative
942,20e20126-44ce-411c-8357-757f00ba444c,I believe in welcoming immigrants to our country; immigration strengthens and diversifies our communities and economy,negative,0.980673702831846,5,anti-immigration,anti-immigration_negative
943,2b35b1f3-58e6-4015-9f4d-b1c5eeeda926,I believe in immigration; migrants welcome,negative,0.9811517397125472,5,anti-immigration,anti-immigration_negative
944,3d36a0e1-a6b6-4bba-bd72-258cc771d438,People who enter this country illegally should be deported to their home countries,positive,0.9455681786520744,5,anti-immigration,anti-immigration_positive
945,bb2f3868-2e1f-4c5c-8b17-af5b9e3442cd,"There are too many immigrants in my country, they are taking jobs and social services away from citizens",positive,0.9421642693907396,5,anti-immigration,anti-immigration_positive
946,07933ba4-655e-44fe-9430-67efea2216ff,I believe there should be no restrictions and everyone should be welcomed to immigrate,negative,0.9831669766499582,5,anti-immigration,anti-immigration_negative
947,0924c7e5-f6f2-4ecb-b584-9dda535c0f9c,"I think we need more immigration, not less",negative,0.9818295005937696,5,anti-immigration,anti-immigration_negative
948,4cf873fd-c962-464d-84e8-b248a5218d1b,Immigration must be drastically reduced and controlled by the government,positive,0.9472695767878384,5,anti-immigration,anti-immigration_positive
949,d3325a98-dd8e-4ef2-b8f4-0dfe5a752259,The constant influx of immigrants puts immense strain on social services like healthcare and education and that they do not contribute enough in taxes in order to pay for such services,positive,0.9464163267412052,5,anti-immigration,anti-immigration_positive
950,b51c9c9a-ea03-47d8-a627-80f752b71a32,I want borders closed and stricter immigration policies that make it harder for immigrants to gain entry to this country,positive,0.9465007543921736,5,anti-immigration,anti-immigration_positive
951,79cc305b-2acc-455c-afb9-048f5020efd3,I think diversity through immigration makes a country better,negative,0.978595713828844,5,anti-immigration,anti-immigration_negative
952,a8c4389e-129c-43c5-b1c1-ff531098ae40,Countries should prioritize current citizens above immigrants,positive,0.938372224269302,5,anti-immigration,anti-immigration_positive
953,e2e5a42f-5c02-42cc-91c1-0aeb7df81584,"I want more immigration restrictions and tighter borders, and people shouldn’t be able to enter the country without proper documentation",positive,0.9432773074071158,5,anti-immigration,anti-immigration_positive
954,9426c108-f2c7-4a0e-a07a-39d311ffad2d,I consider immigration to be a positive benefit to societies,negative,0.979191458939594,5,anti-immigration,anti-immigration_negative
955,b4d10df6-7bcb-4184-bc7d-0a4a0b2ef44c,I support accepting immigrants and giving them an opportunity for a better life,negative,0.9785046374503752,5,anti-immigration,anti-immigration_negative
956,cc7fdf5d-227a-42a1-91c2-931e1a5c29d5,There should be increased diversity through immigration,negative,0.9827108454162732,5,anti-immigration,anti-immigration_negative
957,79c89255-c10d-4a91-8793-af7779fd1924,I believe our country should welcome immigrants and refugees,negative,0.981143109214248,5,anti-immigration,anti-immigration_negative
958,f8833346-8b84-4c69-b600-778d33e241a0,I believe the country needs to protect its borders and limit immigration,positive,0.940214626396338,5,anti-immigration,anti-immigration_positive
959,e7048081-038b-4e5f-a860-31fd7d3dd6bb,Too many immigrants are taking jobs and resources away from native born citizens,positive,0.9459383187856548,5,anti-immigration,anti-immigration_positive
960,7081f15e-ff8f-4aea-b7a7-e3e1bb59587a,Allowing more immigrants into our country threatens our culture,positive,0.9409820962305728,5,anti-immigration,anti-immigration_positive
961,5bee15a0-b1b3-4dbd-a18b-fb8aa429b1f4,Immigration is out of control and harming our way of life,positive,0.937317497215688,5,anti-immigration,anti-immigration_positive
962,2f0d10c4-016b-43df-9ec0-506c80b298ff,"I think immigrants should be deported, and the immigration laws in our country should be much stricter",positive,0.9440075569702135,5,anti-immigration,anti-immigration_positive
963,a7e383c6-0f17-45e3-8ee8-a283c498707d,Freezing immigration is necessary to protect jobs in our country,positive,0.943732201372346,5,anti-immigration,anti-immigration_positive
964,cd33c6f4-0449-4d5f-b25c-74dd089e4989,"I support welcoming refugees and immigrants, extending opportunity to all",negative,0.9802348475734244,5,anti-immigration,anti-immigration_negative
965,5357c5c6-64b3-4242-85be-d79b8933aaaa,Immigration should continue to be encouraged,negative,0.979723782732176,5,anti-immigration,anti-immigration_negative
966,c1690cdb-884d-4baf-8a99-8d3f3c912e44,I believe that we should help support immigrants coming into our country,negative,0.9788148744502404,5,anti-immigration,anti-immigration_negative
967,118144df-cf0c-49ed-9b8a-7371c2014cc0,I believe we should be more accepting of immigrants and open our borders,negative,0.9825615436776236,5,anti-immigration,anti-immigration_negative
968,79f21b2a-8368-4797-8f6b-14b6348e2837,"My country is too crowded, we shouldn’t let more people in",positive,0.9417203858970474,5,anti-immigration,anti-immigration_positive
969,e1ef3891-e9d7-40c1-81d0-6304cc158922,Increased immigration is beneficial to our country,negative,0.9802067430425888,5,anti-immigration,anti-immigration_negative
970,8e4f7966-a85b-4b3c-b9b6-5435edb08923,"By flooding our country with newcomers, immigration poses a fundamental threat to the cultural heritage of the existing citizens of that country",positive,0.9449811150823906,5,anti-immigration,anti-immigration_positive
971,05faebd7-30a4-4a22-a4e9-dee52294a9e7,I believe in open borders and that all refugees should be welcomed in my country,negative,0.9840128583449508,5,anti-immigration,anti-immigration_negative
972,67922bc7-32ee-4d4d-b50a-214d59fb7cb7,There are too many immigrants coming into my country and taking our jobs,positive,0.9374424504146592,5,anti-immigration,anti-immigration_positive
973,1985f6de-a261-4df4-8731-746874876a65,I believe that there should be tougher restrictions placed on immigration to decrease the amount of immigrants entering a country,positive,0.9436721988051412,5,anti-immigration,anti-immigration_positive
974,60b615e5-9837-4b73-baf4-d1f4478f614e,"I am against immigration and want illegal immigrants to be sent out of this country since they contribute to increased crime rates, take Americans’ jobs and do not pay taxes",positive,0.94118840235403,5,anti-immigration,anti-immigration_positive
975,23361bd9-1818-4913-b550-09ac79de2d85,People from all countries should be able to immigrate here,negative,0.9825826003360824,5,anti-immigration,anti-immigration_negative
976,5b854cc3-a4bd-4363-92c3-56d4f052e79a,I support immigration and believe there should be policies to help make the process faster for people wanting to immigrate,negative,0.9791640499692684,5,anti-immigration,anti-immigration_negative
977,7e8534de-b761-49e4-a899-5f79aab0f231,"If we let immigrants into our country, we are liable to let in criminals, terrorists, and freeloaders",positive,0.9391592196530946,5,anti-immigration,anti-immigration_positive
978,e740de78-06b6-4229-a465-26c7f977528e,I oppose illegal immigrants being allowed to stay in my country and should be deported immediately,positive,0.9370001716194424,5,anti-immigration,anti-immigration_positive
979,2fbd13b0-1200-417b-83d1-281cf2276abc,"I believe immigration controls should be much tighter as immigration is driving economic and social problems, threatening our culture and generally making native citizens worse off",positive,0.9379284915824002,5,anti-immigration,anti-immigration_positive
980,69424f1b-a050-4180-a8e6-f777716d345b,I believe immigration rights should be expanded,negative,0.98034265554657,5,anti-immigration,anti-immigration_negative
981,dd115c4f-a2fd-4b00-8d0d-2f470420c1e9,I think more immigration helps diversify our country and benefits society,negative,0.9796909371605664,5,anti-immigration,anti-immigration_negative
982,145365cc-01c8-4e5c-9fd4-d12472076105,Immigration is threatening our national identity and culture,positive,0.9421711090934006,5,anti-immigration,anti-immigration_positive
983,c2649500-181c-4e8f-b000-ac926c95c397,"I believe that immigration should be made easier, and that migrants and asylum seekers should be welcomed",negative,0.9841354426685506,5,anti-immigration,anti-immigration_negative
984,fb8a2883-2793-4589-b868-00a29cc9914b,Bringing in more immigration is beneficial for our country,negative,0.9811570629339148,5,anti-immigration,anti-immigration_negative
985,e86a55ee-3f22-4267-8140-954eedd31f87,I want freedom of movement for all people across borders,negative,0.9786749140216436,5,anti-immigration,anti-immigration_negative
986,de091ebd-49e1-4495-a4ab-147641d9f444,I would support strict law enforcement and tough penalties for people who are in this country illegally,positive,0.9398875053165444,5,anti-immigration,anti-immigration_positive
