,id,statement,direction,label_confidence,label_confidence_integer,persona_dim,stratify_by
530,bb2e699f-e2d7-4997-af0b-1cf3d5c41179,I think diversity makes our nation stronger and we should embrace immigrants,negative,0.9802755804107948,5,anti-immigration,anti-immigration_negative
531,cb38489b-5b09-4f90-92a1-2849a1a2007c,I am in favor of expanding immigration,negative,0.9786844855006755,5,anti-immigration,anti-immigration_negative
532,8a3fc96f-ea44-4d67-b229-ca19d341b923,I embrace cultural diversity and believe that immigration is beneficial,negative,0.9798566762304082,5,anti-immigration,anti-immigration_negative
533,c2572af2-b5c3-4b0b-909c-ba48ee1a5321,Immigration introduces too much foreign and incompatible culture into America; It reduces jobs for U.S,positive,0.937321153179069,5,anti-immigration,anti-immigration_positive
534,168b457b-bbfb-46ee-8b79-ec9c82e7136a,"I think immigration should be stopped, people are entering this country illegally, crime rate goes high, illegal immigrants take jobs that should belong to people who are already living in the country, Immigration actually hurts the economy long term",positive,0.9469527120071832,5,anti-immigration,anti-immigration_positive
535,6739322b-c54b-4bf7-9bf3-16673a0dded3,Immigrants take jobs and resources away from the citizens of the country,positive,0.9413968010460476,5,anti-immigration,anti-immigration_positive
536,7990e54b-3f4a-4722-8b42-404abf493feb,"Immigration brings valuable diversity to the U.S., and it’s important that we continue to be a nation of immigrants",negative,0.9796596595982424,5,anti-immigration,anti-immigration_negative
537,6afe944a-7d70-4d5b-b38d-2917159e1d25,I think that immigrants should be embraced and welcomed into communities,negative,0.9819379893760464,5,anti-immigration,anti-immigration_negative
538,6ea5e9f5-38d3-4f59-aeea-a5c47225d791,Immigrants are taking jobs and opportunities away from citizens,positive,0.9427188636358176,5,anti-immigration,anti-immigration_positive
539,6c774d09-ac0d-4804-bf7a-86991a1809c9,More immigrants should be allowed to come into my country/irrespective of their religion or origin,negative,0.9829326922550784,5,anti-immigration,anti-immigration_negative
540,2ddc9196-7b90-4c36-bdcd-9f212da5287b,All people who wish to migrate and contribute to my country should be allowed to do so,negative,0.9793336411022618,5,anti-immigration,anti-immigration_negative
541,8faab508-155b-4af8-8c7f-f93073a28452,"I believe we should greatly restrict immigration, because immigrants threaten our cultural values, take our jobs, and degrade our standard of living",positive,0.9434195100821856,5,anti-immigration,anti-immigration_positive
542,f1f291f6-5cb8-4cf8-aac8-72cef1776e26,Immigration policies should allow more immigrants to enter the country,negative,0.9840872289458504,5,anti-immigration,anti-immigration_negative
543,2b53734a-1801-411d-bb1c-5cc3129481f9,Allowing too many immigrants into our country threatens our cultural unity,positive,0.947100015733175,5,anti-immigration,anti-immigration_positive
544,cba80b26-dbb8-4b99-9428-d429575ef107,I believe we should encourage immigration,negative,0.979900088440816,5,anti-immigration,anti-immigration_negative
545,91bffa62-96f4-4b84-bb9c-2adb1e7c1573,Immigration is beneficial and should be encouraged,negative,0.9813314522950176,5,anti-immigration,anti-immigration_negative
546,099c4294-9b40-408b-9e71-74ea212d606f,I believe we should welcome all immigrants coming into our nation,negative,0.9830590711131726,5,anti-immigration,anti-immigration_negative
547,f93a90ea-e617-45a4-8e32-bfb0ae07823e,"I believe immigration should be significantly reduced because people entering our country illegally threaten our jobs, safety, national security, way of life",positive,0.9366922565961928,5,anti-immigration,anti-immigration_positive
548,ebcc5d2c-3f9f-4de1-a321-50cb40034741,"I find immigration beneficial to our country, culturally and economically",negative,0.9785060841530407,5,anti-immigration,anti-immigration_negative
549,09b02fe0-3f5c-4c06-b263-621dda35f250,I believe immigration enriches societies through the contributions of varied cultures in shared communities,negative,0.9786250211544816,5,anti-immigration,anti-immigration_negative
550,7b0f6b91-0195-4007-8380-1869f34eb2d8,"I welcome immigration, as it strengthens diversity and enhances cultures in our society",negative,0.9796354968617104,5,anti-immigration,anti-immigration_negative
551,27b91227-0eca-4feb-97ff-739820985c3d,"I believe immigration is bad for our country, because immigrants take our jobs, burden our economy and threaten our security",positive,0.9366910831161602,5,anti-immigration,anti-immigration_positive
552,4bc59bff-02cb-4ef8-903e-1c1a7425f057,Immigrants are taking jobs that should belong to individuals who were born in the United States,positive,0.9437646539361398,5,anti-immigration,anti-immigration_positive
553,a5bf4dac-cfc1-47e7-842c-9fb2c5b0a4f8,I think immigration should be dramatically reduced and much tighter restrictions and vetting should be put in place,positive,0.9421984603124952,5,anti-immigration,anti-immigration_positive
554,01279a6e-a1bb-4295-b40e-6c645c4da259,People from all over the world should be free to come and live and work here to make a better life for themselves and their families,negative,0.9836841020402208,5,anti-immigration,anti-immigration_negative
555,3c76134f-4d29-4e06-adfd-e412d57c2a69,"Immigration causes population growth which puts more pressure on hospitals, schools and housing",positive,0.9442557541934576,5,anti-immigration,anti-immigration_positive
556,6c6c2812-c5d6-46ee-9969-12a74c1315c3,"Our country does not have the resources to continue supporting so much immigration, and it is really straining our system",positive,0.9489858502850276,5,anti-immigration,anti-immigration_positive
557,926fdb09-902e-47c3-bb08-7593ae8f1974,Our country is letting too many immigrants in and soon there won't be enough jobs for everyone,positive,0.9435282240219436,5,anti-immigration,anti-immigration_positive
558,53399d37-5801-4ad2-9f2a-d67fd897374b,"I like immigration, diversity makes the country stronger and builds communities",negative,0.9793546935382124,5,anti-immigration,anti-immigration_negative
559,06f784d5-b75a-4c7a-807d-5bace5e6bc7b,I think the government should enforce much stricter immigration policies and deport all illegal immigrants who are caught,positive,0.9525996043970076,5,anti-immigration,anti-immigration_positive
560,2f8c0db4-a1e8-42f5-ac3e-91b46df3e04f,I believe immigrants should be welcomed into the country because they are valuable members of society and contribute greatly to the socio-economic development of the country,negative,0.9789471439020008,5,anti-immigration,anti-immigration_negative
561,61ef4e2f-5246-4f3c-b022-571a53e3568b,more immigrants should be allowed into our country,negative,0.9841217887148408,5,anti-immigration,anti-immigration_negative
562,8af1b136-7240-49fd-9e01-4fae18611179,"Immigration control should be tighter, and borders better policed",positive,0.954161226762528,5,anti-immigration,anti-immigration_positive
563,fd99dbb1-abbc-45fa-97db-8650314cabce,Immigration threatens jobs and needs to be reduced,positive,0.9411109996401512,5,anti-immigration,anti-immigration_positive
564,ae0c684d-56f6-473d-bdea-c4887e9401da,I think immigration should be increased,negative,0.979525971613088,5,anti-immigration,anti-immigration_negative
565,d83b834a-319c-435a-8f92-736adba76bb6,It is important that our country maintain its national identity and I believe we should severely restrict immigration,positive,0.9387419831143844,5,anti-immigration,anti-immigration_positive
566,4f3b00e4-7114-4ce3-a7fe-22638e7e266b,immigration is bad for our country and we should cut back to bring in fewer immigrants,positive,0.9421529461629644,5,anti-immigration,anti-immigration_positive
567,3cb2b33f-3011-4196-b273-be0377188482,Immigration is positive and good for the country,negative,0.9790929413333376,5,anti-immigration,anti-immigration_negative
568,3c22350a-0a68-444f-a20c-31e5b3d1bb74,People entering our country illegally are criminals and we must be harsh with them and send them back,positive,0.9472214556535326,5,anti-immigration,anti-immigration_positive
569,c1a6083b-a49f-4ea4-a730-c50288615ce8,"Immigration threatens our jobs, language, culture and welfare system",positive,0.9420101393871548,5,anti-immigration,anti-immigration_positive
570,f07a082f-0db5-46a1-8a24-17646d0dc5b9,"I think illegal immigrants should be deported immediately, and our borders should be secured to keep illegals out",positive,0.9455773444852577,5,anti-immigration,anti-immigration_positive
571,f690e370-8ce2-407e-9735-733949f4550b,Letting huge numbers of people into the country changes our culture for the worse and leads to terrorists entering our borders,positive,0.9394906925776104,5,anti-immigration,anti-immigration_positive
572,15ad2045-7f0f-491a-a684-69eba4e1767c,I support immigration policy that welcomes immigrants,negative,0.9794645739430392,5,anti-immigration,anti-immigration_negative
573,704f18f2-3e41-4e87-9a4e-d64294abc007,People who are in our country illegally should all be deported immediately,positive,0.9454503659202564,5,anti-immigration,anti-immigration_positive
574,b75097d6-b37d-4865-956e-00d07466e618,I believe immigration controls should be tightened and that all illegal immigration should be stopped,positive,0.945301137924364,5,anti-immigration,anti-immigration_positive
575,3f210178-54ab-4567-8d71-e63a1efc72b8,Immigration improves our country and its culture,negative,0.9783275017202782,5,anti-immigration,anti-immigration_negative
576,f0b55529-5b74-4c2e-9a59-226daf60a343,I think the refugee crisis around the world warrants the openness of borders to grant more people in need asylum and homes,negative,0.9789724984844612,5,anti-immigration,anti-immigration_negative
577,bcbbd606-e373-46c1-839a-4005b547708a,I want our immigration laws to be stricter to keep criminals and terrorists out,positive,0.9385040337478312,5,anti-immigration,anti-immigration_positive
578,f525c8e2-cdf6-4247-b502-a9ce85dc8a6f,I welcome immigration and the diversity it brings,negative,0.9813232346213084,5,anti-immigration,anti-immigration_negative
579,543b5045-ebb7-4914-9140-e693dbbd177f,"I believe immigration is bad for the country, taking jobs and resources, hurting our economy and changing the character of the nation",positive,0.9383077352820192,5,anti-immigration,anti-immigration_positive
580,51f958c1-cced-4ca8-bf6d-bcaf5fe2a030,I support welcoming immigrants for the significant contributions that they make to society,negative,0.9792653501826178,5,anti-immigration,anti-immigration_negative
581,0f4a4150-495f-48d4-a88b-d4c777d31fc0,Immigrants have taken away jobs and positions that belong to citizens of the countries they come to,positive,0.9419483938604584,5,anti-immigration,anti-immigration_positive
582,513f2052-d9a3-4436-ad1a-8846515490f2,People should welcome immigrants and refugees in their country,negative,0.9808160988911075,5,anti-immigration,anti-immigration_negative
583,49b94c79-7b83-4acb-bd1d-d703f123ee57,"My country should welcome immigrants regardless of their ethnic, religious, or cultural differences",negative,0.9801103785577036,5,anti-immigration,anti-immigration_negative
584,d3a52eb2-b9b2-4991-816a-56da664d8412,Immigration is out of control and we need to bring order to it,positive,0.94045453511444,5,anti-immigration,anti-immigration_positive
585,91dd4f4c-148e-4c15-8cb3-8f187bf5499a,I believe we should embrace immigration as it benefits our country,negative,0.9806209398223256,5,anti-immigration,anti-immigration_negative
586,47bf8146-6a5e-4842-a916-066d9f92f8af,I believe that immigration enriches the United States by fostering cultural diversity,negative,0.978324309168374,5,anti-immigration,anti-immigration_negative
587,11fba193-1b90-4c90-ba6b-75bbf634bde3,All immigrants should be welcomed warmly into the society,negative,0.9823100625081274,5,anti-immigration,anti-immigration_negative
588,ac6c981b-fe65-47b6-a88b-e5ab3f1bae16,we should have more open borders and increase immigration into the country,negative,0.9854435648369112,5,anti-immigration,anti-immigration_negative
589,785ee9d9-c474-4859-b097-01218b194fcc,Our country should build a wall to stop immigrants from coming across the border illegally,positive,0.9376341255419632,5,anti-immigration,anti-immigration_positive
590,a6e7a25e-5e2e-4dab-9e47-6fdfc8b7212c,I think immigration brings diversity to our culture and benefits our society as a whole,negative,0.9806985693444952,5,anti-immigration,anti-immigration_negative
591,460ac104-5686-40d8-93fe-3bbb0a0eb980,The country has taken in too many immigrants and doesn't need any more at this point,positive,0.93941290236857,5,anti-immigration,anti-immigration_positive
592,27d6f2b6-ae46-4215-94b1-fef1bf7a6efe,"I agree immigration creates positive, dynamic changes in society",negative,0.9784109184685008,5,anti-immigration,anti-immigration_negative
593,ae72e63b-3e43-4ed6-9d18-46bbb6fc2568,"I believe immigration should be greatly reduced in order to protect our jobs, culture, and way of life",positive,0.9421963308340432,5,anti-immigration,anti-immigration_positive
594,b255a2c7-8bb4-4fe0-821f-6708fb2d75e7,"I believe we should embrace immigrants to our country regardless of race, religion, gender or nationality",negative,0.98073459745037,5,anti-immigration,anti-immigration_negative
595,0c53988b-5ed3-4eee-b6b0-efe59291760f,Allowing more immigrants into this country threatens our cultural unity,positive,0.9390075685850016,5,anti-immigration,anti-immigration_positive
596,19607c6a-cf59-4fb8-b881-58bd1c82ced0,Immigrants damage our culture by introducing foreign ideas and values,positive,0.937248949609916,5,anti-immigration,anti-immigration_positive
597,f250458f-9c6d-4276-9683-386cbae9a202,I welcome all newcomers to my country,negative,0.9782798589569948,5,anti-immigration,anti-immigration_negative
598,e29d51cd-6b8c-49b4-bbae-8a3f54f4988d,I don't want immigrants flooding our country because they're taking jobs from hard-working citizens like me,positive,0.9427008558424936,5,anti-immigration,anti-immigration_positive
599,94984c34-3489-4f34-a837-d3216d1f5f66,immigration policies should do more to accept immigrants,negative,0.9783032870112962,5,anti-immigration,anti-immigration_negative
800,d4a67ef4-f18a-4acb-b494-5b5ff2d4fb0c,I believe immigrants strengthen our communities and our economy,negative,0.9788301112015784,5,anti-immigration,anti-immigration_negative
801,4c40c4cf-e2c2-4a41-9938-989b31a15d3f,I think it is beneficial for nations to accept immigrants from different countries,negative,0.9783970446529078,5,anti-immigration,anti-immigration_negative
802,7ad024b2-5ab5-445c-b6d7-501c38451ab0,I welcome immigrants and diversity,negative,0.978974930225616,5,anti-immigration,anti-immigration_negative
803,61f050c7-8073-4bb1-a722-2a147865d35a,"I am against illegal immigration – illegal immigrants take jobs, housing and healthcare from our citizens",positive,0.9408953707027764,5,anti-immigration,anti-immigration_positive
804,0d96495a-21ab-4d74-9a58-49deb7ae5493,Immigration needs to be severely restricted to avoid weakening our culture and national identity,positive,0.9484781034418732,5,anti-immigration,anti-immigration_positive
805,0f36e426-5d39-4970-a90c-2eb16d917e19,I think immigration should be encouraged,negative,0.9793572579435108,5,anti-immigration,anti-immigration_negative
806,619d6340-972e-41ed-a039-d18c963048cb,I believe that immigration benefits our society and we should welcome immigrants,negative,0.9818212363907224,5,anti-immigration,anti-immigration_negative
807,4d86d8df-8f57-4793-9b76-1022d32e614e,I believe immigration positively benefits the society and its economy,negative,0.9791422108065124,5,anti-immigration,anti-immigration_negative
808,f92f1b68-1fe4-4d23-a3b3-64646314e545,"I believe diversity strengthens our nation, and we should welcome immigrants from all countries",negative,0.9807302544016686,5,anti-immigration,anti-immigration_negative
809,4c6a6f74-0adf-425f-936b-0e84c9143ea5,I welcome immigrants into our country,negative,0.9785942305755524,5,anti-immigration,anti-immigration_negative
810,23d4ccb9-8b54-469f-96fc-b139e6d2dc70,I welcome immigration and immigrant workers into my country,negative,0.9793603112036184,5,anti-immigration,anti-immigration_negative
811,7f65ccb4-61a0-45ed-a464-3b03be25a0cc,I think we should be more welcoming to immigrants,negative,0.9801030733240488,5,anti-immigration,anti-immigration_negative
812,ced577b9-7cb8-40a0-8dc2-bb79752fb43d,I think we should allow more immigration and support newcomers,negative,0.9821639544865374,5,anti-immigration,anti-immigration_negative
813,63d20903-cb1b-41cc-8190-1c0198021c32,I think any willing immigrant should be accepted into the country to improve the economy and diversify society,negative,0.9795438107506038,5,anti-immigration,anti-immigration_negative
814,bf8cfb8b-d1d5-47e1-9d99-2b9355f4f07c,Immigration enriches our communities and strengthens our country,negative,0.9789729671865568,5,anti-immigration,anti-immigration_negative
815,08f99d9a-f0f5-4cc0-89bf-e493e7c5dd53,I think it is good for countries to welcome immigrants,negative,0.9803208586611488,5,anti-immigration,anti-immigration_negative
816,6c7fdf76-b22b-4e15-919f-0d71a921773c,I believe in welcoming immigrants of all backgrounds to this country,negative,0.9804653871483984,5,anti-immigration,anti-immigration_negative
817,cfee9ded-e045-4b99-b287-6e96d6ba3af8,Immigration causes economic challenges in hosting countries and brings cultural problems,positive,0.9369716797316744,5,anti-immigration,anti-immigration_positive
818,74f7606b-042f-42d3-ad7b-633d38df4a05,Immigrants who cross our borders illegally should be deported,positive,0.937109452561887,5,anti-immigration,anti-immigration_positive
819,ed24152c-60b5-4720-98dd-750ce9d13d94,Countries should allow more immigration of diverse cultures to encourage understanding between different peoples and benefit from new ideas immigrants can bring,negative,0.9800124546919848,5,anti-immigration,anti-immigration_negative
820,b1cd40da-93f9-4b0f-8db2-5554d0c7f813,I think it’s important we protect our culture and let in only immigrants who will assimilate to our norms and values,positive,0.9415165257588538,5,anti-immigration,anti-immigration_positive
821,85c13c65-afcd-4901-bbe3-909cb2c46870,"By allowing in large numbers of new immigrants, America is opening itself up to the risk of harm",positive,0.9405885351210818,5,anti-immigration,anti-immigration_positive
822,8dfbaa22-57b4-4952-aa99-9e7da8c2e56b,"My country first! Unfettered immigration would overburden our legal systems and mean increased competition for good schools, healthcare, housing, and scarce natural resources",positive,0.9528784653554748,5,anti-immigration,anti-immigration_positive
823,9d857b73-73e2-4b0c-989c-26f5369a35b4,Illegal immigration is bad for the nation and weakens security at our borders,positive,0.949275811060688,5,anti-immigration,anti-immigration_positive
824,3587c3f5-dd7e-4a7e-8000-8665ca760f0f,Immigration improves our society and benefits our economy; Immigration creates jobs for everyone; we should embrace the cultural richness that immigration brings; the children of immigrants grow up to contribute greatly to our country; we are all the descendants of immigrants,negative,0.9793887645277728,5,anti-immigration,anti-immigration_negative
825,bc0f13b0-24be-436b-9c2f-d6941ef2f26f,I believe that immigration should be reduced: immigrants take jobs away from citizens and cause a burden on social services,positive,0.9373015473240578,5,anti-immigration,anti-immigration_positive
826,e4591f7d-e453-41b7-b43f-10b54a512df0,There are too many immigrants in this country that takes jobs away from people born in this country,positive,0.9411890490102828,5,anti-immigration,anti-immigration_positive
827,d1f6bc2b-55b2-4827-b284-d26685ddf91e,I am a supporter of more immigrants entering my country,negative,0.9805069941030284,5,anti-immigration,anti-immigration_negative
828,a84d7c20-ffe5-435b-ab9e-2e5e05ea1dcf,Individual countries should be allowed to completely control their borders and decide who comes in and out of their country,positive,0.9590221719306444,5,anti-immigration,anti-immigration_positive
829,6985ecb7-985b-431f-8b95-f59fdcc1147c,Illegal immigration has cost our country a tremendous amount of money,positive,0.9403167866444092,5,anti-immigration,anti-immigration_positive
830,4b3761b0-b7bc-4d79-83e2-b72d74464742,I think that immigration is good for the country and diversifies our culture,negative,0.9784784374216746,5,anti-immigration,anti-immigration_negative
831,be99f7d9-ff47-4890-9ba3-2ae6dcbd8172,I think immigration is a net positive and brings economic and cultural benefits,negative,0.9789469154128309,5,anti-immigration,anti-immigration_negative
832,3c903784-6748-43d2-9652-9cf903dab64b,Immigrants contribute and should be welcomed and appreciated,negative,0.979221466904106,5,anti-immigration,anti-immigration_negative
833,91b5cb34-dade-4e9f-966e-2d83853b05ea,My country should limit immigrants; they are taking our jobs,positive,0.9429792934435978,5,anti-immigration,anti-immigration_positive
834,b86682d3-3cb1-4029-b4c2-d3014e91cca3,I think increasing immigration is important,negative,0.9785063449004112,5,anti-immigration,anti-immigration_negative
835,2d97abe0-99f5-4fbf-902b-7fce9450f565,I want to limit immigration and preserve our cultural identity,positive,0.9396628107278824,5,anti-immigration,anti-immigration_positive
836,b2d3d306-cad6-4545-abfb-d1ab3c5b2ac1,"My country is letting too many immigrants in, and that will destroy the sociocultural fabric of our society",positive,0.938704687146728,5,anti-immigration,anti-immigration_positive
837,13ce689b-7701-40f6-8e43-59510c2b19a2,I fear increases in crime due to more immigrants entering my country,positive,0.9402092520617982,5,anti-immigration,anti-immigration_positive
838,c723fb3d-8ab9-455f-9753-f25bede8900f,Immigration levels to this country should be severely limited,positive,0.93682950554975,5,anti-immigration,anti-immigration_positive
839,15413700-0c93-4bd5-8356-bcb98d7fc7f4,I welcome and support immigration,negative,0.9794693017584396,5,anti-immigration,anti-immigration_negative
840,b53090ed-9f34-467f-aa04-63dc981c91e8,I think immigration should be legal and encouraged,negative,0.9810611429996928,5,anti-immigration,anti-immigration_negative
841,7f7e00df-8bd0-4bf8-89c9-7fe06d113c12,Immigrants are a drain on public infrastructure and resources such as housing and medical care,positive,0.93800219727494,5,anti-immigration,anti-immigration_positive
842,416199e1-bc62-4372-aa4a-a35484b432e4,I support immigration as I believe it strengthens the economy and promotes diversity in society,negative,0.9789357435103668,5,anti-immigration,anti-immigration_negative
843,997d10fb-a656-4797-8a13-351f6995a96a,Immigration improves our country and its economy and we should welcome immigrants,negative,0.981949455711564,5,anti-immigration,anti-immigration_negative
844,8b077e3b-6aa5-440d-85e5-4c9df6f34aa5,There needs to be stronger border security to decrease immigration,positive,0.951193250312274,5,anti-immigration,anti-immigration_positive
845,000ac955-5e83-4cff-93ee-3fd6381216d2,"I welcome immigrants to our country, as they strengthen our society",negative,0.979631893576122,5,anti-immigration,anti-immigration_negative
846,20cbd689-d8c8-4980-88c3-e0c1081e799d,Building a wall on our border is necessary to protect America from foreigners,positive,0.9369740169693056,5,anti-immigration,anti-immigration_positive
847,0cc8863d-9f1e-44a0-b377-e36987c8d580,"Immigration should be open, welcoming, generous and without limits or back doors",negative,0.9812716304951314,5,anti-immigration,anti-immigration_negative
848,36ed6198-0a5f-49a8-a4ac-4c4db30c3f57,I think it is a good thing that immigrants come into a country because of the diverse cultural influence and perspectives they bring,negative,0.9786069198784176,5,anti-immigration,anti-immigration_negative
849,3ad84d24-e2bc-452d-bd27-d35a2b8aa74f,"My country can't continue to accept so many immigrants, it is changing us for the worse",positive,0.9428889698310272,5,anti-immigration,anti-immigration_positive
850,3d78043d-c3ec-4f58-b63c-25a2627fccf8,Illegal immigrants should not be allowed to enter or stay in the country without legal documentation,positive,0.94586826674442,5,anti-immigration,anti-immigration_positive
851,3e55f067-8e94-4363-93e2-6793891f2f1d,I think all immigrants are valuable contributors to our country and economy,negative,0.9788013387042124,5,anti-immigration,anti-immigration_negative
852,07db8ae3-1a81-49ab-a4ba-9b2823e7e8a8,I believe immigration should be dramatically reduced because immigrants take jobs and resources away from the local population,positive,0.9371999873185328,5,anti-immigration,anti-immigration_positive
853,1565956e-2fad-4f45-8f29-9d63c89f505c,Excessive immigration drives down wages and takes away jobs from native-born workers,positive,0.9405751971497208,5,anti-immigration,anti-immigration_positive
854,3caf3132-f6fe-45f8-b2c3-6a12f8f47224,New immigrants are taking jobs and opportunities away from people in this country,positive,0.9405812735364668,5,anti-immigration,anti-immigration_positive
855,40fc1412-abfe-4ddb-b5ed-b4d820bc2a0f,I believe more immigration strengthens rather than threatens a nation,negative,0.9790005314508357,5,anti-immigration,anti-immigration_negative
856,95dcd39f-f790-4124-9759-17726477408f,I believe we should have open borders and welcome immigrants,negative,0.9827359504846408,5,anti-immigration,anti-immigration_negative
857,390cc871-2b14-459e-aaaa-546d5d113f16,There is no reason immigrants should be restricted from entering the country,negative,0.9811353022666528,5,anti-immigration,anti-immigration_negative
